{
    "$schema": "../schemas/v0/tests.schema.json",
    "scenario": "Syntax",
    "description": "Test cases that do not depend on any registry definitions.",
    "defaultTestProperties": {
        "bidiIsolation": "none",
        "locale": "en-US"
    },
    "tests": [
        {
            "description": "message -> simple-message -> <empty>",
            "src": "",
            "exp": ""
        },
        {
            "description": "message -> simple-message -> simple-start pattern -> simple-start-char",
            "src": "a",
            "exp": "a"
        },
        {
            "description": "message -> simple-message -> simple-start pattern -> simple-start-char pattern -> ...",
            "src": "hello",
            "exp": "hello"
        },
        {
            "description": "message -> simple-message -> simple-start pattern -> escaped-char",
            "src": "\\\\",
            "exp": "\\"
        },
        {
            "description": "message -> simple-message -> simple-start pattern -> 1*escaped-char",
            "src": "\\\\\\{\\|\\}",
            "exp": "\\{|}"
        },
        {
            "description": "message -> simple-message -> simple-start pattern -> simple-start-char pattern -> ... -> simple-start-char *text-char placeholder",
            "src": "hello {world}",
            "exp": "hello world"
        },
        {
            "description": "message -> simple-message -> simple-start pattern -> simple-start-char pattern -> ... -> simple-start-char *text-char placeholder",
            "src": "hello {|world|}",
            "exp": "hello world"
        },
        {
            "description": "message -> simple-message -> s simple-start pattern -> s simple-start-char pattern -> ...",
            "src": "\n hello\t",
            "exp": "\n hello\t"
        },
        {
            "src": "hello {$place}",
            "params": [
                {
                    "name": "place",
                    "value": "world"
                }
            ],
            "exp": "hello world"
        },
        {
            "src": "hello {$place-.}",
            "params": [
                {
                    "name": "place-.",
                    "value": "world"
                }
            ],
            "exp": "hello world"
        },
        {
            "src": "hello {$place}",
            "expErrors": [
                {
                    "type": "unresolved-variable"
                }
            ],
            "exp": "hello {$place}"
        },
        {
            "description": "message -> simple-message -> simple-start pattern -> placeholder -> expression -> literal-expression -> \"{\" literal \"}\"",
            "src": "{a}",
            "exp": "a"
        },
        {
            "description": "... -> literal-expression -> \"{\" literal s annotation \"}\" -> \"{\" literal s function \"}\" -> \"{\" literal s \":\" identifier \"}\" -> \"{\" literal s \":\" name \"}\"",
            "src": "{a :f}",
            "exp": "{|a|}",
            "expErrors": [{ "type": "unknown-function" }],
            "only": true
        },
        {
            "description": "... -> \"{\" literal s \":\" namespace \":\" name \"}\"",
            "src": "{a :u:f}",
            "exp": "{|a|}",
            "expErrors": [{ "type": "unknown-function" }]
        },
        {
            "description": "message -> simple-message -> simple-start pattern -> placeholder -> expression -> variable-expression -> \"{\" variable \"}\"",
            "src": "{$x}",
            "exp": "{$x}",
            "expErrors": [{ "type": "unresolved-variable" }]
        },
        {
            "description": "... -> variable-expression -> \"{\" variable s annotation \"}\" -> \"{\" variable s function \"}\" -> \"{\" variable s \":\" identifier \"}\" -> \"{\" variable s \":\" name \"}\"",
            "src": "{$x :f}",
            "exp": "{$x}",
            "expErrors": [
                { "type": "unresolved-variable" },
                { "type": "unknown-function" }
            ]
        },
        {
            "description": "... -> \"{\" variable s \":\" namespace \":\" name \"}\"",
            "src": "{$x :u:f}",
            "exp": "{$x}",
            "expErrors": [
                { "type": "unresolved-variable" },
                { "type": "unknown-function" }
            ]
        },
        {
            "description": "... -> annotation-expression -> function -> \"{\" \":\" namespace \":\" name \"}\"",
            "src": "{:u:f}",
            "exp": "{:u:f}",
            "expErrors": [{ "type": "unknown-function" }]
        },
        {
            "description": "... -> annotation-expression -> function -> \"{\" \":\" name \"}\"",
            "src": "{:f}",
            "exp": "{:f}",
            "expErrors": [{ "type": "unknown-function" }]
        },
        {
            "description": "message -> complex-message -> complex-body -> quoted-pattern -> \"{{\" pattern \"}}\" -> \"{{\"\"}}\"",
            "src": "{{}}",
            "exp": ""
        },
        {
            "description": "message -> simple-message -> simple-start pattern -> placeholder -> markup -> \"{\" \"#\" identifier \"}\"",
            "src": "{#tag}",
            "exp": "",
            "expParts": [
                {
                    "type": "markup",
                    "kind": "open",
                    "name": "tag"
                }
            ]
        },
        {
            "description": "message -> complex-message -> *(declaration [s]) complex-body -> declaration complex-body -> input-declaration complex-body -> input variable-expression complex-body",
            "src": ".input{$x}{{}}",
            "exp": ""
        },
        {
            "description": "message -> complex-message -> s *(declaration [s]) complex-body s -> s declaration complex-body s -> s input-declaration complex-body s -> s input variable-expression complex-body s",
            "src": "\t.input{$x}{{}}\n",
            "exp": ""
        },
        {
            "description": "message -> complex-message -> *(declaration [s]) complex-body -> declaration declaration complex-body -> input-declaration input-declaration complex-body -> input variable-expression input variable-expression complex-body",
            "src": ".input{$x}.input{$y}{{}}",
            "exp": ""
        },
        {
            "description": "message -> complex-message -> *(declaration [s]) complex-body -> declaration s declaration complex-body -> input-declaration s input-declaration complex-body -> input variable-expression s input variable-expression complex-body",
            "src": ".input{$x} .input{$y}{{}}",
            "exp": ""
        },
        {
            "description": "message -> complex-message -> s *(declaration [s]) complex-body s -> s complex-body s",
            "src": "  {{}}  ",
            "exp": ""
        },
        {
            "description": "message -> complex-message -> *(declaration [s]) complex-body -> declaration declaration complex-body -> local-declaration input-declaration complex-body -> local s variable [s] \"=\" [s] expression input variable-expression complex-body",
            "src": ".local $x ={a}.input{$y}{{}}",
            "exp": ""
        },
        {
            "description": "message -> complex-message -> complex-body -> ... -> matcher -> match-statement variant -> match selector key quoted-pattern -> \".match\" variable literal quoted-pattern",
            "src": ".local $a={a :f}.match $a a{{}}*{{}}",
            "exp": "",
            "expErrors": [
                { "type": "unknown-function" },
                { "type": "bad-selector" }
            ]
        },
        {
            "description": "... input-declaration -> input s variable-expression ...",
            "src": ".input {$x}{{}}",
            "exp": ""
        },
        {
            "description": "... local-declaration -> local s variable s \"=\" expression ...",
            "src": ".local $x ={a}{{}}",
            "exp": ""
        },
        {
            "description": "... local-declaration -> local s variable \"=\" s expression ...",
            "src": ".local $x= {a}{{}}",
            "exp": ""
        },
        {
            "description": "... local-declaration -> local s variable s \"=\" expression ...",
            "src": ".local $x = {a}{{}}",
            "exp": ""
        },
        {
            "description": "input-declaration-like content in complex-message",
            "src": "{{.input {$x}}}",
            "params": [{ "name": "x", "value": "X" }],
            "exp": ".input X"
        },
        {
            "description": "local-declaration-like content in complex-message with leading whitespace",
            "src": "{{ .local $x = {$y}}}",
            "params": [{ "name": "y", "value": "Y" }],
            "exp": " .local $x = Y"
        },
        {
            "description": "... matcher -> match-statement [s] variant -> match 1*([s] selector) variant -> match selector selector variant -> match selector selector variant key s key quoted-pattern",
            "src": ".local $a={a :f}.local $b={b :f}.match $a $b a b{{}}* *{{}}",
            "exp": "",
            "expErrors": [
                { "type": "unknown-function" },
                { "type": "bad-selector" },
                { "type": "unknown-function" },
                { "type": "bad-selector" }
            ]
        },
        {
            "description": "... matcher -> match-statement [s] variant -> match 1*([s] selector) variant -> match selector variant variant ...",
            "src": ".local $a={a :f}.match $a a{{}}b{{}}*{{}}",
            "exp": "",
            "expErrors": [
                { "type": "unknown-function" },
                { "type": "bad-selector" }
            ]
        },
        {
            "description": "... variant -> key s quoted-pattern -> ...",
            "src": ".local $a={a :f}.match $a a {{}}*{{}}",
            "exp": "",